282.0,"Integer aliquet, massa id lobortis convallis, tortor risus dapibus augue, vel accumsan tellus nisi eu orci. Mauris lacinia sapien quis libero. Nullam sit amet turpis elementum ligula vehicula consequat. Morbi a ipsum. Integer a nibh. In quis justo. Maecenas rhoncus aliquam lacus. Morbi quis tortor id nulla ultrices aliquet. Maecenas leo odio, condimentum id, luctus nec, molestie sed, justo. Pellentesque viverra pede ac diam.",,,
283.0,"Suspendisse potenti. Cras in purus eu magna vulputate luctus. Cum sociis natoque penatibus et magnis dis parturient montes, nascetur ridiculus mus. Vivamus vestibulum sagittis sapien. Cum sociis natoque penatibus et magnis dis parturient montes, nascetur ridiculus mus. Etiam vel augue.",,,
284.0,"Morbi porttitor lorem id ligula. Suspendisse ornare consequat lectus. In est risus, auctor sed, tristique in, tempus sit amet, sem. Fusce consequat. Nulla nisl. Nunc nisl. Duis bibendum, felis sed interdum venenatis, turpis enim blandit mi, in porttitor pede justo eu massa. Donec dapibus. Duis at velit eu est congue elementum. In hac habitasse platea dictumst.",,,
285.0,"Sed sagittis. Nam congue, risus semper porta volutpat, quam pede lobortis ligula, sit amet eleifend pede libero quis orci. Nullam molestie nibh in lectus. Pellentesque at nulla. Suspendisse potenti. Cras in purus eu magna vulputate luctus. Cum sociis natoque penatibus et magnis dis parturient montes, nascetur ridiculus mus. Vivamus vestibulum sagittis sapien. Cum sociis natoque penatibus et magnis dis parturient montes, nascetur ridiculus mus.",,,
286.0,"Cras in purus eu magna vulputate luctus. Cum sociis natoque penatibus et magnis dis parturient montes, nascetur ridiculus mus. Vivamus vestibulum sagittis sapien. Cum sociis natoque penatibus et magnis dis parturient montes, nascetur ridiculus mus. Etiam vel augue. Vestibulum rutrum rutrum neque. Aenean auctor gravida sem. Praesent id massa id nisl venenatis lacinia. Aenean sit amet justo. Morbi ut odio.",,,
287.0,"Cras pellentesque volutpat dui. Maecenas tristique, est et tempus semper, est quam pharetra magna, ac consequat metus sapien ut nunc. Vestibulum ante ipsum primis in faucibus orci luctus et ultrices posuere cubilia Curae; Mauris viverra diam vitae quam. Suspendisse potenti. Nullam porttitor lacus at turpis. Donec posuere metus vitae ipsum. Aliquam non mauris. Morbi non lectus. Aliquam sit amet diam in magna bibendum imperdiet.",,,
288.0,Nullam varius. Nulla facilisi. Cras non velit nec nisi vulputate nonummy. Maecenas tincidunt lacus at velit. Vivamus vel nulla eget eros elementum pellentesque. Quisque porta volutpat erat.,,,
289.0,Ut tellus. Nulla ut erat id mauris vulputate elementum. Nullam varius. Nulla facilisi. Cras non velit nec nisi vulputate nonummy.,,,
290.0,"Aenean fermentum. Donec ut mauris eget massa tempor convallis. Nulla neque libero, convallis eget, eleifend luctus, ultricies eu, nibh. Quisque id justo sit amet sapien dignissim vestibulum. Vestibulum ante ipsum primis in faucibus orci luctus et ultrices posuere cubilia Curae; Nulla dapibus dolor vel est. Donec odio justo, sollicitudin ut, suscipit a, feugiat et, eros. Vestibulum ac est lacinia nisi venenatis tristique.",,,
291.0,Pellentesque eget nunc. Donec quis orci eget orci vehicula condimentum. Curabitur in libero ut massa volutpat convallis.,,,
292.0,"Vestibulum rutrum rutrum neque. Aenean auctor gravida sem. Praesent id massa id nisl venenatis lacinia. Aenean sit amet justo. Morbi ut odio. Cras mi pede, malesuada in, imperdiet et, commodo vulputate, justo. In blandit ultrices enim. Lorem ipsum dolor sit amet, consectetuer adipiscing elit. Proin interdum mauris non ligula pellentesque ultrices.",,,
293.0,Etiam faucibus cursus urna. Ut tellus. Nulla ut erat id mauris vulputate elementum. Nullam varius. Nulla facilisi. Cras non velit nec nisi vulputate nonummy. Maecenas tincidunt lacus at velit. Vivamus vel nulla eget eros elementum pellentesque. Quisque porta volutpat erat.,,,
294.0,"Morbi vestibulum, velit id pretium iaculis, diam erat fermentum justo, nec condimentum neque sapien placerat ante. Nulla justo. Aliquam quis turpis eget elit sodales scelerisque. Mauris sit amet eros. Suspendisse accumsan tortor quis turpis. Sed ante. Vivamus tortor.",,,
295.0,"Suspendisse potenti. In eleifend quam a odio. In hac habitasse platea dictumst. Maecenas ut massa quis augue luctus tincidunt. Nulla mollis molestie lorem. Quisque ut erat. Curabitur gravida nisi at nibh. In hac habitasse platea dictumst. Aliquam augue quam, sollicitudin vitae, consectetuer eget, rutrum at, lorem. Integer tincidunt ante vel ipsum.",,,
296.0,"Cras non velit nec nisi vulputate nonummy. Maecenas tincidunt lacus at velit. Vivamus vel nulla eget eros elementum pellentesque. Quisque porta volutpat erat. Quisque erat eros, viverra eget, congue eget, semper rutrum, nulla.",,,
297.0,"Proin risus. Praesent lectus. Vestibulum quam sapien, varius ut, blandit non, interdum in, ante. Vestibulum ante ipsum primis in faucibus orci luctus et ultrices posuere cubilia Curae; Duis faucibus accumsan odio. Curabitur convallis. Duis consequat dui nec nisi volutpat eleifend. Donec ut dolor. Morbi vel lectus in quam fringilla rhoncus. Mauris enim leo, rhoncus sed, vestibulum sit amet, cursus id, turpis. Integer aliquet, massa id lobortis convallis, tortor risus dapibus augue, vel accumsan tellus nisi eu orci.",,,
298.0,"Quisque ut erat. Curabitur gravida nisi at nibh. In hac habitasse platea dictumst. Aliquam augue quam, sollicitudin vitae, consectetuer eget, rutrum at, lorem. Integer tincidunt ante vel ipsum.",,,
299.0,"Phasellus in felis. Donec semper sapien a libero. Nam dui. Proin leo odio, porttitor id, consequat in, consequat ut, nulla. Sed accumsan felis. Ut at dolor quis odio consequat varius. Integer ac leo. Pellentesque ultrices mattis odio.",,,
300.0,"Praesent lectus. Vestibulum quam sapien, varius ut, blandit non, interdum in, ante. Vestibulum ante ipsum primis in faucibus orci luctus et ultrices posuere cubilia Curae; Duis faucibus accumsan odio.",,,
301.0,"Duis mattis egestas metus. Aenean fermentum. Donec ut mauris eget massa tempor convallis. Nulla neque libero, convallis eget, eleifend luctus, ultricies eu, nibh. Quisque id justo sit amet sapien dignissim vestibulum. Vestibulum ante ipsum primis in faucibus orci luctus et ultrices posuere cubilia Curae; Nulla dapibus dolor vel est. Donec odio justo, sollicitudin ut, suscipit a, feugiat et, eros. Vestibulum ac est lacinia nisi venenatis tristique. Fusce congue, diam id ornare imperdiet, sapien urna pretium nisl, ut volutpat sapien arcu sed augue. Aliquam erat volutpat.",,,
302.0,"In quis justo. Maecenas rhoncus aliquam lacus. Morbi quis tortor id nulla ultrices aliquet. Maecenas leo odio, condimentum id, luctus nec, molestie sed, justo. Pellentesque viverra pede ac diam. Cras pellentesque volutpat dui. Maecenas tristique, est et tempus semper, est quam pharetra magna, ac consequat metus sapien ut nunc.",,,
303.0,Nullam varius. Nulla facilisi. Cras non velit nec nisi vulputate nonummy. Maecenas tincidunt lacus at velit. Vivamus vel nulla eget eros elementum pellentesque. Quisque porta volutpat erat.,,,
304.0,"Nulla nisl. Nunc nisl. Duis bibendum, felis sed interdum venenatis, turpis enim blandit mi, in porttitor pede justo eu massa. Donec dapibus. Duis at velit eu est congue elementum. In hac habitasse platea dictumst.",,,
305.0,Etiam justo. Etiam pretium iaculis justo. In hac habitasse platea dictumst. Etiam faucibus cursus urna. Ut tellus. Nulla ut erat id mauris vulputate elementum. Nullam varius. Nulla facilisi. Cras non velit nec nisi vulputate nonummy.,,,
306.0,"Nam dui. Proin leo odio, porttitor id, consequat in, consequat ut, nulla. Sed accumsan felis. Ut at dolor quis odio consequat varius. Integer ac leo.",,,
307.0,"Morbi quis tortor id nulla ultrices aliquet. Maecenas leo odio, condimentum id, luctus nec, molestie sed, justo. Pellentesque viverra pede ac diam. Cras pellentesque volutpat dui. Maecenas tristique, est et tempus semper, est quam pharetra magna, ac consequat metus sapien ut nunc. Vestibulum ante ipsum primis in faucibus orci luctus et ultrices posuere cubilia Curae; Mauris viverra diam vitae quam. Suspendisse potenti. Nullam porttitor lacus at turpis. Donec posuere metus vitae ipsum.",,,
308.0,Duis mattis egestas metus. Aenean fermentum. Donec ut mauris eget massa tempor convallis.,,,
309.0,"Pellentesque eget nunc. Donec quis orci eget orci vehicula condimentum. Curabitur in libero ut massa volutpat convallis. Morbi odio odio, elementum eu, interdum eu, tincidunt in, leo. Maecenas pulvinar lobortis est. Phasellus sit amet erat. Nulla tempus.",,,
310.0,"In hac habitasse platea dictumst. Morbi vestibulum, velit id pretium iaculis, diam erat fermentum justo, nec condimentum neque sapien placerat ante. Nulla justo. Aliquam quis turpis eget elit sodales scelerisque. Mauris sit amet eros. Suspendisse accumsan tortor quis turpis. Sed ante. Vivamus tortor. Duis mattis egestas metus.",,,
311.0,Etiam pretium iaculis justo. In hac habitasse platea dictumst. Etiam faucibus cursus urna. Ut tellus. Nulla ut erat id mauris vulputate elementum. Nullam varius. Nulla facilisi. Cras non velit nec nisi vulputate nonummy. Maecenas tincidunt lacus at velit.,,,
312.0,"Vestibulum ac est lacinia nisi venenatis tristique. Fusce congue, diam id ornare imperdiet, sapien urna pretium nisl, ut volutpat sapien arcu sed augue. Aliquam erat volutpat. In congue. Etiam justo. Etiam pretium iaculis justo. In hac habitasse platea dictumst. Etiam faucibus cursus urna. Ut tellus.",,,
313.0,"In est risus, auctor sed, tristique in, tempus sit amet, sem. Fusce consequat. Nulla nisl. Nunc nisl. Duis bibendum, felis sed interdum venenatis, turpis enim blandit mi, in porttitor pede justo eu massa. Donec dapibus. Duis at velit eu est congue elementum. In hac habitasse platea dictumst.",,,
314.0,In hac habitasse platea dictumst. Etiam faucibus cursus urna. Ut tellus. Nulla ut erat id mauris vulputate elementum. Nullam varius. Nulla facilisi. Cras non velit nec nisi vulputate nonummy. Maecenas tincidunt lacus at velit. Vivamus vel nulla eget eros elementum pellentesque. Quisque porta volutpat erat.,,,
315.0,"Maecenas rhoncus aliquam lacus. Morbi quis tortor id nulla ultrices aliquet. Maecenas leo odio, condimentum id, luctus nec, molestie sed, justo. Pellentesque viverra pede ac diam. Cras pellentesque volutpat dui. Maecenas tristique, est et tempus semper, est quam pharetra magna, ac consequat metus sapien ut nunc. Vestibulum ante ipsum primis in faucibus orci luctus et ultrices posuere cubilia Curae; Mauris viverra diam vitae quam. Suspendisse potenti. Nullam porttitor lacus at turpis.",,,
316.0,"Nunc purus. Phasellus in felis. Donec semper sapien a libero. Nam dui. Proin leo odio, porttitor id, consequat in, consequat ut, nulla. Sed accumsan felis.",,,
317.0,"Duis bibendum. Morbi non quam nec dui luctus rutrum. Nulla tellus. In sagittis dui vel nisl. Duis ac nibh. Fusce lacus purus, aliquet at, feugiat non, pretium quis, lectus.",,,
318.0,"Fusce posuere felis sed lacus. Morbi sem mauris, laoreet ut, rhoncus aliquet, pulvinar sed, nisl. Nunc rhoncus dui vel sem.",,,
319.0,"Integer tincidunt ante vel ipsum. Praesent blandit lacinia erat. Vestibulum sed magna at nunc commodo placerat. Praesent blandit. Nam nulla. Integer pede justo, lacinia eget, tincidunt eget, tempus vel, pede. Morbi porttitor lorem id ligula. Suspendisse ornare consequat lectus.",,,
320.0,"Nulla suscipit ligula in lacus. Curabitur at ipsum ac tellus semper interdum. Mauris ullamcorper purus sit amet nulla. Quisque arcu libero, rutrum ac, lobortis vel, dapibus at, diam. Nam tristique tortor eu pede.",,,
321.0,"In quis justo. Maecenas rhoncus aliquam lacus. Morbi quis tortor id nulla ultrices aliquet. Maecenas leo odio, condimentum id, luctus nec, molestie sed, justo. Pellentesque viverra pede ac diam.",,,
322.0,"Nulla neque libero, convallis eget, eleifend luctus, ultricies eu, nibh. Quisque id justo sit amet sapien dignissim vestibulum. Vestibulum ante ipsum primis in faucibus orci luctus et ultrices posuere cubilia Curae; Nulla dapibus dolor vel est. Donec odio justo, sollicitudin ut, suscipit a, feugiat et, eros. Vestibulum ac est lacinia nisi venenatis tristique. Fusce congue, diam id ornare imperdiet, sapien urna pretium nisl, ut volutpat sapien arcu sed augue. Aliquam erat volutpat. In congue. Etiam justo.",,,
323.0,"Donec quis orci eget orci vehicula condimentum. Curabitur in libero ut massa volutpat convallis. Morbi odio odio, elementum eu, interdum eu, tincidunt in, leo. Maecenas pulvinar lobortis est. Phasellus sit amet erat. Nulla tempus. Vivamus in felis eu sapien cursus vestibulum. Proin eu mi.",,,
324.0,"Curabitur in libero ut massa volutpat convallis. Morbi odio odio, elementum eu, interdum eu, tincidunt in, leo. Maecenas pulvinar lobortis est. Phasellus sit amet erat. Nulla tempus. Vivamus in felis eu sapien cursus vestibulum.",,,
325.0,"Nulla nisl. Nunc nisl. Duis bibendum, felis sed interdum venenatis, turpis enim blandit mi, in porttitor pede justo eu massa. Donec dapibus. Duis at velit eu est congue elementum. In hac habitasse platea dictumst.",,,
326.0,"Integer ac leo. Pellentesque ultrices mattis odio. Donec vitae nisi. Nam ultrices, libero non mattis pulvinar, nulla pede ullamcorper augue, a suscipit nulla elit ac nulla. Sed vel enim sit amet nunc viverra dapibus. Nulla suscipit ligula in lacus.",,,
327.0,"Vivamus tortor. Duis mattis egestas metus. Aenean fermentum. Donec ut mauris eget massa tempor convallis. Nulla neque libero, convallis eget, eleifend luctus, ultricies eu, nibh. Quisque id justo sit amet sapien dignissim vestibulum. Vestibulum ante ipsum primis in faucibus orci luctus et ultrices posuere cubilia Curae; Nulla dapibus dolor vel est. Donec odio justo, sollicitudin ut, suscipit a, feugiat et, eros.",,,
328.0,"Nulla neque libero, convallis eget, eleifend luctus, ultricies eu, nibh. Quisque id justo sit amet sapien dignissim vestibulum. Vestibulum ante ipsum primis in faucibus orci luctus et ultrices posuere cubilia Curae; Nulla dapibus dolor vel est. Donec odio justo, sollicitudin ut, suscipit a, feugiat et, eros. Vestibulum ac est lacinia nisi venenatis tristique. Fusce congue, diam id ornare imperdiet, sapien urna pretium nisl, ut volutpat sapien arcu sed augue. Aliquam erat volutpat.",,,
329.0,"Duis bibendum, felis sed interdum venenatis, turpis enim blandit mi, in porttitor pede justo eu massa. Donec dapibus. Duis at velit eu est congue elementum. In hac habitasse platea dictumst. Morbi vestibulum, velit id pretium iaculis, diam erat fermentum justo, nec condimentum neque sapien placerat ante. Nulla justo. Aliquam quis turpis eget elit sodales scelerisque.",,,
330.0,"Curabitur convallis. Duis consequat dui nec nisi volutpat eleifend. Donec ut dolor. Morbi vel lectus in quam fringilla rhoncus. Mauris enim leo, rhoncus sed, vestibulum sit amet, cursus id, turpis. Integer aliquet, massa id lobortis convallis, tortor risus dapibus augue, vel accumsan tellus nisi eu orci.",,,
331.0,"Nullam varius. Nulla facilisi. Cras non velit nec nisi vulputate nonummy. Maecenas tincidunt lacus at velit. Vivamus vel nulla eget eros elementum pellentesque. Quisque porta volutpat erat. Quisque erat eros, viverra eget, congue eget, semper rutrum, nulla. Nunc purus. Phasellus in felis. Donec semper sapien a libero.",,,
332.0,"Vestibulum ac est lacinia nisi venenatis tristique. Fusce congue, diam id ornare imperdiet, sapien urna pretium nisl, ut volutpat sapien arcu sed augue. Aliquam erat volutpat. In congue.",,,
333.0,"Nullam molestie nibh in lectus. Pellentesque at nulla. Suspendisse potenti. Cras in purus eu magna vulputate luctus. Cum sociis natoque penatibus et magnis dis parturient montes, nascetur ridiculus mus. Vivamus vestibulum sagittis sapien. Cum sociis natoque penatibus et magnis dis parturient montes, nascetur ridiculus mus. Etiam vel augue.",,,
334.0,"Cum sociis natoque penatibus et magnis dis parturient montes, nascetur ridiculus mus. Etiam vel augue. Vestibulum rutrum rutrum neque. Aenean auctor gravida sem. Praesent id massa id nisl venenatis lacinia. Aenean sit amet justo. Morbi ut odio. Cras mi pede, malesuada in, imperdiet et, commodo vulputate, justo. In blandit ultrices enim. Lorem ipsum dolor sit amet, consectetuer adipiscing elit.",,,
335.0,"Etiam vel augue. Vestibulum rutrum rutrum neque. Aenean auctor gravida sem. Praesent id massa id nisl venenatis lacinia. Aenean sit amet justo. Morbi ut odio. Cras mi pede, malesuada in, imperdiet et, commodo vulputate, justo.",,,
336.0,"In eleifend quam a odio. In hac habitasse platea dictumst. Maecenas ut massa quis augue luctus tincidunt. Nulla mollis molestie lorem. Quisque ut erat. Curabitur gravida nisi at nibh. In hac habitasse platea dictumst. Aliquam augue quam, sollicitudin vitae, consectetuer eget, rutrum at, lorem.",,,
337.0,"Morbi porttitor lorem id ligula. Suspendisse ornare consequat lectus. In est risus, auctor sed, tristique in, tempus sit amet, sem. Fusce consequat. Nulla nisl. Nunc nisl. Duis bibendum, felis sed interdum venenatis, turpis enim blandit mi, in porttitor pede justo eu massa.",,,
338.0,"Fusce consequat. Nulla nisl. Nunc nisl. Duis bibendum, felis sed interdum venenatis, turpis enim blandit mi, in porttitor pede justo eu massa. Donec dapibus. Duis at velit eu est congue elementum.",,,
339.0,"Aliquam non mauris. Morbi non lectus. Aliquam sit amet diam in magna bibendum imperdiet. Nullam orci pede, venenatis non, sodales sed, tincidunt eu, felis. Fusce posuere felis sed lacus. Morbi sem mauris, laoreet ut, rhoncus aliquet, pulvinar sed, nisl. Nunc rhoncus dui vel sem. Sed sagittis.",,,
340.0,"Nulla nisl. Nunc nisl. Duis bibendum, felis sed interdum venenatis, turpis enim blandit mi, in porttitor pede justo eu massa. Donec dapibus. Duis at velit eu est congue elementum. In hac habitasse platea dictumst. Morbi vestibulum, velit id pretium iaculis, diam erat fermentum justo, nec condimentum neque sapien placerat ante.",,,
341.0,Donec posuere metus vitae ipsum. Aliquam non mauris. Morbi non lectus.,,,
342.0,"Sed ante. Vivamus tortor. Duis mattis egestas metus. Aenean fermentum. Donec ut mauris eget massa tempor convallis. Nulla neque libero, convallis eget, eleifend luctus, ultricies eu, nibh.",,,
343.0,"Vestibulum ac est lacinia nisi venenatis tristique. Fusce congue, diam id ornare imperdiet, sapien urna pretium nisl, ut volutpat sapien arcu sed augue. Aliquam erat volutpat. In congue. Etiam justo. Etiam pretium iaculis justo. In hac habitasse platea dictumst. Etiam faucibus cursus urna.",,,
344.0,"Morbi ut odio. Cras mi pede, malesuada in, imperdiet et, commodo vulputate, justo. In blandit ultrices enim. Lorem ipsum dolor sit amet, consectetuer adipiscing elit. Proin interdum mauris non ligula pellentesque ultrices.",,,
345.0,"Proin eu mi. Nulla ac enim. In tempor, turpis nec euismod scelerisque, quam turpis adipiscing lorem, vitae mattis nibh ligula nec sem. Duis aliquam convallis nunc. Proin at turpis a pede posuere nonummy. Integer non velit. Donec diam neque, vestibulum eget, vulputate ut, ultrices vel, augue. Vestibulum ante ipsum primis in faucibus orci luctus et ultrices posuere cubilia Curae; Donec pharetra, magna vestibulum aliquet ultrices, erat tortor sollicitudin mi, sit amet lobortis sapien sapien non mi. Integer ac neque. Duis bibendum.",,,
346.0,"Sed sagittis. Nam congue, risus semper porta volutpat, quam pede lobortis ligula, sit amet eleifend pede libero quis orci. Nullam molestie nibh in lectus. Pellentesque at nulla.",,,
347.0,"Donec ut mauris eget massa tempor convallis. Nulla neque libero, convallis eget, eleifend luctus, ultricies eu, nibh. Quisque id justo sit amet sapien dignissim vestibulum. Vestibulum ante ipsum primis in faucibus orci luctus et ultrices posuere cubilia Curae; Nulla dapibus dolor vel est. Donec odio justo, sollicitudin ut, suscipit a, feugiat et, eros. Vestibulum ac est lacinia nisi venenatis tristique. Fusce congue, diam id ornare imperdiet, sapien urna pretium nisl, ut volutpat sapien arcu sed augue. Aliquam erat volutpat.",,,
348.0,"Curabitur convallis. Duis consequat dui nec nisi volutpat eleifend. Donec ut dolor. Morbi vel lectus in quam fringilla rhoncus. Mauris enim leo, rhoncus sed, vestibulum sit amet, cursus id, turpis. Integer aliquet, massa id lobortis convallis, tortor risus dapibus augue, vel accumsan tellus nisi eu orci.",,,
349.0,"Phasellus sit amet erat. Nulla tempus. Vivamus in felis eu sapien cursus vestibulum. Proin eu mi. Nulla ac enim. In tempor, turpis nec euismod scelerisque, quam turpis adipiscing lorem, vitae mattis nibh ligula nec sem.",,,
350.0,"Sed sagittis. Nam congue, risus semper porta volutpat, quam pede lobortis ligula, sit amet eleifend pede libero quis orci. Nullam molestie nibh in lectus.",,,
351.0,"Nulla facilisi. Cras non velit nec nisi vulputate nonummy. Maecenas tincidunt lacus at velit. Vivamus vel nulla eget eros elementum pellentesque. Quisque porta volutpat erat. Quisque erat eros, viverra eget, congue eget, semper rutrum, nulla. Nunc purus. Phasellus in felis. Donec semper sapien a libero. Nam dui.",,,
352.0,"Cras pellentesque volutpat dui. Maecenas tristique, est et tempus semper, est quam pharetra magna, ac consequat metus sapien ut nunc. Vestibulum ante ipsum primis in faucibus orci luctus et ultrices posuere cubilia Curae; Mauris viverra diam vitae quam. Suspendisse potenti. Nullam porttitor lacus at turpis. Donec posuere metus vitae ipsum. Aliquam non mauris. Morbi non lectus. Aliquam sit amet diam in magna bibendum imperdiet.",,,
353.0,"Proin leo odio, porttitor id, consequat in, consequat ut, nulla. Sed accumsan felis. Ut at dolor quis odio consequat varius. Integer ac leo.",,,
354.0,"Nullam molestie nibh in lectus. Pellentesque at nulla. Suspendisse potenti. Cras in purus eu magna vulputate luctus. Cum sociis natoque penatibus et magnis dis parturient montes, nascetur ridiculus mus. Vivamus vestibulum sagittis sapien. Cum sociis natoque penatibus et magnis dis parturient montes, nascetur ridiculus mus. Etiam vel augue.",,,
355.0,Nulla justo. Aliquam quis turpis eget elit sodales scelerisque. Mauris sit amet eros.,,,
356.0,"Phasellus sit amet erat. Nulla tempus. Vivamus in felis eu sapien cursus vestibulum. Proin eu mi. Nulla ac enim. In tempor, turpis nec euismod scelerisque, quam turpis adipiscing lorem, vitae mattis nibh ligula nec sem. Duis aliquam convallis nunc. Proin at turpis a pede posuere nonummy. Integer non velit.",,,
357.0,Ut tellus. Nulla ut erat id mauris vulputate elementum. Nullam varius. Nulla facilisi. Cras non velit nec nisi vulputate nonummy. Maecenas tincidunt lacus at velit.,,,
358.0,"Maecenas tincidunt lacus at velit. Vivamus vel nulla eget eros elementum pellentesque. Quisque porta volutpat erat. Quisque erat eros, viverra eget, congue eget, semper rutrum, nulla. Nunc purus. Phasellus in felis. Donec semper sapien a libero. Nam dui. Proin leo odio, porttitor id, consequat in, consequat ut, nulla.",,,
359.0,"Maecenas leo odio, condimentum id, luctus nec, molestie sed, justo. Pellentesque viverra pede ac diam. Cras pellentesque volutpat dui. Maecenas tristique, est et tempus semper, est quam pharetra magna, ac consequat metus sapien ut nunc. Vestibulum ante ipsum primis in faucibus orci luctus et ultrices posuere cubilia Curae; Mauris viverra diam vitae quam. Suspendisse potenti.",,,
360.0,"Maecenas rhoncus aliquam lacus. Morbi quis tortor id nulla ultrices aliquet. Maecenas leo odio, condimentum id, luctus nec, molestie sed, justo. Pellentesque viverra pede ac diam. Cras pellentesque volutpat dui. Maecenas tristique, est et tempus semper, est quam pharetra magna, ac consequat metus sapien ut nunc. Vestibulum ante ipsum primis in faucibus orci luctus et ultrices posuere cubilia Curae; Mauris viverra diam vitae quam.",,,
361.0,"Etiam faucibus cursus urna. Ut tellus. Nulla ut erat id mauris vulputate elementum. Nullam varius. Nulla facilisi. Cras non velit nec nisi vulputate nonummy. Maecenas tincidunt lacus at velit. Vivamus vel nulla eget eros elementum pellentesque. Quisque porta volutpat erat. Quisque erat eros, viverra eget, congue eget, semper rutrum, nulla.",,,
362.0,"Nam nulla. Integer pede justo, lacinia eget, tincidunt eget, tempus vel, pede. Morbi porttitor lorem id ligula. Suspendisse ornare consequat lectus. In est risus, auctor sed, tristique in, tempus sit amet, sem. Fusce consequat. Nulla nisl.",,,
363.0,"Vivamus metus arcu, adipiscing molestie, hendrerit at, vulputate vitae, nisl. Aenean lectus. Pellentesque eget nunc.",,,
364.0,"Donec ut dolor. Morbi vel lectus in quam fringilla rhoncus. Mauris enim leo, rhoncus sed, vestibulum sit amet, cursus id, turpis. Integer aliquet, massa id lobortis convallis, tortor risus dapibus augue, vel accumsan tellus nisi eu orci. Mauris lacinia sapien quis libero.",,,
365.0,"Integer aliquet, massa id lobortis convallis, tortor risus dapibus augue, vel accumsan tellus nisi eu orci. Mauris lacinia sapien quis libero. Nullam sit amet turpis elementum ligula vehicula consequat. Morbi a ipsum. Integer a nibh. In quis justo. Maecenas rhoncus aliquam lacus. Morbi quis tortor id nulla ultrices aliquet. Maecenas leo odio, condimentum id, luctus nec, molestie sed, justo.",,,
366.0,"Aliquam sit amet diam in magna bibendum imperdiet. Nullam orci pede, venenatis non, sodales sed, tincidunt eu, felis. Fusce posuere felis sed lacus. Morbi sem mauris, laoreet ut, rhoncus aliquet, pulvinar sed, nisl. Nunc rhoncus dui vel sem. Sed sagittis. Nam congue, risus semper porta volutpat, quam pede lobortis ligula, sit amet eleifend pede libero quis orci. Nullam molestie nibh in lectus. Pellentesque at nulla. Suspendisse potenti.",,,
